{
  "slug": "foundry",
  "title": "Foundry Gallery",
  "tagline": "~23 tiny, self-contained linguistics toys — etymology timelines to phonetics visualisers — spun up by the build system",
  "category": "standalone",
  "standalone": true,
  "substance_rank": 60,
  "badges": [
    {
      "label": "standalone",
      "kind": "ok"
    }
  ],
  "thumbnail": "assets/foundry/thumb.jpg",
  "links": {
    "open": "./foundry/"
  },
  "functionality": [
    {
      "name": "Etymology Timelines",
      "blurb": "Trace how words evolve over time with self-contained etymology timeline toys."
    },
    {
      "name": "Phonetics Visualisers",
      "blurb": "Small visualisers for exploring the sounds of language."
    },
    {
      "name": "Language Games",
      "blurb": "Quick, playful language games to poke at how words work."
    },
    {
      "name": "Logic-of-Ideas Demos",
      "blurb": "Compact demos exploring the logic of ideas."
    },
    {
      "name": "Auto-Generated Set",
      "blurb": "The whole grab-bag of roughly 23 toys is auto-generated by the build system."
    }
  ],
  "detail_body": [
    "A collection of <b>~23 small, self-contained linguistics toys</b> — etymology timelines, phonetics visualisers, language games, and logic-of-ideas demos.",
    "Every toy is <em>auto-generated by the build system</em>: a grab-bag of quick, curious experiments to explore."
  ]
}
